[
  {
    "schemaVersion": "1.0",
    "pageId": "p01",
    "title": "为什么做 PPagenT",
    "items": [
      {
        "id": "statement-01",
        "title": "",
        "body": "做 PPT 真正昂贵的，是这些反复发生的判断。",
        "emphasis": true
      }
    ],
    "sourceText": "做 PPT 真正昂贵的，是这些反复发生的判断。"
  },
  {
    "schemaVersion": "1.0",
    "pageId": "p02",
    "title": "真正费时间的不是“画”",
    "items": [
      {
        "id": "judgment-01",
        "title": "先决定怎么讲",
        "body": "这场汇报到底怎么讲，一篇长稿应该拆成多少页，每一页只讲什么。"
      },
      {
        "id": "judgment-02",
        "title": "再判断怎样表达",
        "body": "这几个观点是并列、递进、因果还是流程，哪里应该突出，什么时候应该用图，什么时候一句话反而更有力量。"
      },
      {
        "id": "judgment-03",
        "title": "还要寻找已有答案",
        "body": "翻以前做过的 PPT，找一个差不多的页面，替换内容、调整结构，再统一字体、字号、颜色和间距。"
      },
      {
        "id": "question-01",
        "title": "",
        "body": "既然一个高手已经知道怎样做是好的，为什么每次还要重新做一遍？",
        "emphasis": true
      }
    ],
    "sourceText": "真正费时间的不是把文本框拖到左边还是右边，而是一连串判断：这场汇报到底怎么讲，一篇长稿应该拆成多少页，每一页只讲什么，这几个观点是并列、递进、因果还是流程，哪里应该突出，什么时候应该用图，什么时候一句话反而更有力量。\n\n接下来，人还要翻以前做过的 PPT，找一个差不多的页面，替换内容、调整结构，再统一字体、字号、颜色和间距。\n\n做 PPT 真正昂贵的，是这些反复发生的判断。而一个 PPT 做得很好的人，脑子里已经积累了大量答案。\n\n所以我一直在想：\n\n> **既然一个高手已经知道怎样做是好的，为什么每次还要重新做一遍？**"
  },
  {
    "schemaVersion": "1.0",
    "pageId": "p03",
    "title": "工作里的 PPT，不需要每次重新发明",
    "items": [
      {
        "id": "contrast-01",
        "title": "AI 已经能够自由生成",
        "body": "今天的 AI 已经能够根据一份材料生成一套 PPT，也能直接画出非常自由、非常炫的页面。"
      },
      {
        "id": "principle-01",
        "title": "每次都不一样，有时候才是缺点",
        "body": "工作里的 PPT，很多时候并不需要每次重新设计。"
      },
      {
        "id": "principle-02",
        "title": "不必让 AI 重新猜",
        "body": "颜色、字体、页眉页脚和已经反复证明好用的页面结构，没有必要每次都让 AI 重新猜。"
      },
      {
        "id": "principle-03",
        "title": "主动牺牲一部分自由",
        "body": "换取可靠、稳定和效率。固定不一定意味着落后；在正式工作里，固定往往意味着已经验证过。",
        "emphasis": true
      }
    ],
    "sourceText": "今天的 AI 已经能够根据一份材料生成一套 PPT，也能直接画出非常自由、非常炫的页面。\n\n但工作里的 PPT，很多时候并不需要每次重新设计。甚至恰恰相反：\n\n> **每次都不一样，有时候才是缺点。**\n\n学校有学校的样子，企业有企业的样子，一个人也可以有自己长期形成的表达方式。颜色、字体、页眉页脚和已经反复证明好用的页面结构，没有必要每次都让 AI 重新猜。\n\nPPagenT 会主动牺牲一部分自由，换取可靠、稳定和效率。固定不一定意味着落后；在正式工作里，固定往往意味着已经验证过。"
  },
  {
    "schemaVersion": "1.0",
    "pageId": "p04",
    "title": "AI 负责理解，规则负责决定，代码负责执行",
    "items": [
      {
        "id": "role-01",
        "title": "AI 负责理解",
        "body": "读取稿件，判断重点、关系、拆页和表达目的。"
      },
      {
        "id": "role-02",
        "title": "规则负责决定",
        "body": "判断哪些版式可以使用、内容是否装得下、什么时候应该换版式或拆页。"
      },
      {
        "id": "role-03",
        "title": "代码负责执行",
        "body": "稳定生成原生可编辑的 PowerPoint。"
      },
      {
        "id": "summary-01",
        "title": "",
        "body": "AI 读懂稿子，然后调用人已经提前做好的好东西。",
        "emphasis": true
      }
    ],
    "sourceText": "PPagenT 并不是简单地“让 AI 做 PPT”。\n\n> **AI 负责理解。** 读取稿件，判断重点、关系、拆页和表达目的。\n\n> **规则负责决定。** 判断哪些版式可以使用、内容是否装得下、什么时候应该换版式或拆页。\n\n> **代码负责执行。** 按照已经确认的坐标、字号、颜色和间距，稳定生成原生可编辑的 PowerPoint。\n\n换一种更直接的说法：\n\n> **AI 读懂稿子，然后调用人已经提前做好的好东西。**"
  },
  {
    "schemaVersion": "1.0",
    "pageId": "p05",
    "title": "稳定的 80 分，比随机的 95 分更值钱",
    "items": [
      {
        "id": "scenario-01",
        "title": "真实场景很普通",
        "body": "明天上午要汇报，晚上把稿件交给系统。"
      },
      {
        "id": "expectation-01",
        "title": "需要的是能用于工作",
        "body": "结构清楚、视觉规范、符合组织风格，而且第二天仍然可以继续修改的 PPT。"
      },
      {
        "id": "standard-01",
        "title": "稳定交付 80 分初稿",
        "body": "如果系统能够稳定交付一个真正能用于工作的 80 分初稿，它就已经节省了大量时间。",
        "emphasis": true
      }
    ],
    "sourceText": "真正的使用场景往往很普通：明天上午要汇报，晚上把稿件交给系统，希望得到一套结构清楚、视觉规范、符合组织风格，而且第二天仍然可以继续修改的 PPT。\n\n如果系统能够稳定交付一个真正能用于工作的 80 分初稿，它就已经节省了大量时间。\n\n> **对工作来说，稳定的 80 分，很多时候比随机的 95 分更值钱。**"
  },
  {
    "schemaVersion": "1.0",
    "pageId": "p06",
    "title": "不只服务最会做 PPT 的那 1%",
    "items": [
      {
        "id": "audience-01",
        "title": "更多人并不缺内容",
        "body": "他们有内容、有专业知识，也有真实的汇报任务。"
      },
      {
        "id": "barrier-01",
        "title": "缺的是制作能力",
        "body": "只是不擅长拆页、选择表达方式和完成视觉排版。"
      },
      {
        "id": "value-01",
        "title": "把方法做成系统",
        "body": "让更多人用较低的成本和较少的时间获得接近专业标准的结果。"
      },
      {
        "id": "outcome-01",
        "title": "",
        "body": "把原来只存在于个人大脑和个人电脑里的能力，变成更多人可以使用的生产能力。",
        "emphasis": true
      }
    ],
    "sourceText": "最会做 PPT 的少数人也许并不需要 PPagenT。他们自己可以做得更好。\n\n但更多的人有内容、有专业知识，也有真实的汇报任务，只是不擅长拆页、选择表达方式和完成视觉排版。\n\n如果能够把少数熟练制作者已经掌握的方法做成系统，让更多人用较低的成本和较少的时间获得接近专业标准的结果，这个产品就有价值。\n\nPPagenT 不需要让所有人成为设计师。它要做的是把原来只存在于个人大脑和个人电脑里的能力，变成更多人可以使用的生产能力。"
  },
  {
    "schemaVersion": "1.0",
    "pageId": "p07",
    "title": "真正积累的不是一万个模板",
    "items": [
      {
        "id": "limit-01",
        "title": "内容不可能被模板穷尽",
        "body": "原页面有三个观点，新稿件可能有四个；原页面每项十个字，新内容可能每项六十个字。"
      },
      {
        "id": "experience-01",
        "title": "要积累页面背后的经验",
        "body": "什么内容适合怎样表达，一个版式能够处理多少内容，超过边界以后怎样变化，哪些情况即使能够画出来也不应该使用。"
      },
      {
        "id": "capability-01",
        "title": "从作品变成能力",
        "body": "一个漂亮页面只有在这些规律被提炼出来以后，才能从一件作品变成一种能力。",
        "emphasis": true
      }
    ],
    "sourceText": "现实中的内容永远不可能被模板穷尽。原页面有三个观点，新稿件可能有四个；原页面每项十个字，新内容可能每项六十个字。\n\n所以 PPagenT 真正要积累的不是页面数量，而是页面背后的经验：什么内容适合怎样表达，一个版式能够处理多少内容，超过边界以后怎样变化，哪些情况即使能够画出来也不应该使用。\n\n一个漂亮页面只有在这些规律被提炼出来以后，才能从一件作品变成一种能力。"
  },
  {
    "schemaVersion": "1.0",
    "pageId": "p08",
    "title": "东北大学可以是第一个落地场景，但不会是最终边界",
    "items": [
      {
        "id": "boundary-01",
        "title": "视觉规范可以替换",
        "body": "学校视觉规范只是可替换的一套组织视觉系统。"
      },
      {
        "id": "reuse-01",
        "title": "经验能力可以复用",
        "body": "内容理解、拆页、表达规则和失败经验可以继续服务其他学校、企业、实验室和个人。",
        "emphasis": true
      }
    ],
    "sourceText": "东北大学可以是第一个落地场景，但不会是 PPagenT 的最终边界。学校视觉规范只是可替换的一套组织视觉系统；内容理解、拆页、表达规则和失败经验可以继续服务其他学校、企业、实验室和个人。"
  },
  {
    "schemaVersion": "1.0",
    "pageId": "p09",
    "title": "把一个很会做 PPT 的人的经验留下来",
    "items": [
      {
        "id": "mission-01",
        "title": "让 AI 帮我们读稿子",
        "body": "让规则帮我们做判断，让代码完成重复劳动。"
      },
      {
        "id": "conclusion-01",
        "title": "",
        "body": "如果能做到这一点，这个项目就值得做。",
        "emphasis": true
      }
    ],
    "sourceText": "PPagenT 想把一个很会做 PPT 的人的经验留下来：让 AI 帮我们读稿子，让规则帮我们做判断，让代码完成重复劳动。\n\n最后，让一个原本不太会做 PPT 的人，也能很快得到一套：\n\n> **不一定惊艳，但靠谱；不一定独一无二，但真的好用；而且第二天还可以继续修改的 PPT。**\n\n如果能做到这一点，这个项目就值得做。"
  }
]
